{"baseline_rust_snapshot":"a97ce88454d2ab938e6f8892dcac861845302c09","families":{"GSI-01":{"name":"Runtime, platform, and global execution","systems":["GSI-01.01","GSI-01.02","GSI-01.03","GSI-01.04","GSI-01.05","GSI-01.06","GSI-01.07","GSI-01.08","GSI-01.09","GSI-01.10","GSI-01.11","GSI-01.12","GSI-01.13","GSI-01.14"]},"GSI-02":{"name":"Files, configuration, type data, and asset decoding","systems":["GSI-02.01","GSI-02.02","GSI-02.03","GSI-02.04","GSI-02.05","GSI-02.06","GSI-02.07","GSI-02.08","GSI-02.09","GSI-02.10","GSI-02.11","GSI-02.12","GSI-02.13","GSI-02.14","GSI-02.15","GSI-02.16","GSI-02.17"]},"GSI-03":{"name":"Shell, setup, loading, and game modes","systems":["GSI-03.01","GSI-03.02","GSI-03.03","GSI-03.04","GSI-03.05","GSI-03.06","GSI-03.07","GSI-03.08","GSI-03.09","GSI-03.10","GSI-03.11","GSI-03.12","GSI-03.13","GSI-03.14","GSI-03.15","GSI-03.16","GSI-03.17"]},"GSI-04":{"name":"World, map, terrain, and environment","systems":["GSI-04.01","GSI-04.02","GSI-04.03","GSI-04.04","GSI-04.05","GSI-04.06","GSI-04.07","GSI-04.08","GSI-04.09","GSI-04.10","GSI-04.11","GSI-04.12","GSI-04.13","GSI-04.14","GSI-04.15","GSI-04.16","GSI-04.17","GSI-04.18","GSI-04.19","GSI-04.20","GSI-04.21","GSI-04.22","GSI-04.23"]},"GSI-05":{"name":"Entity model, ownership, and lifecycle","systems":["GSI-05.01","GSI-05.02","GSI-05.03","GSI-05.04","GSI-05.05","GSI-05.06","GSI-05.07","GSI-05.08","GSI-05.09","GSI-05.10","GSI-05.11","GSI-05.12","GSI-05.13","GSI-05.14","GSI-05.15","GSI-05.16","GSI-05.17","GSI-05.18","GSI-05.19","GSI-05.20","GSI-05.21"]},"GSI-06":{"name":"Navigation, locomotion, and physical movement","systems":["GSI-06.01","GSI-06.02","GSI-06.03","GSI-06.04","GSI-06.05","GSI-06.06","GSI-06.07","GSI-06.08","GSI-06.09","GSI-06.10","GSI-06.11","GSI-06.12","GSI-06.13","GSI-06.14","GSI-06.15","GSI-06.16","GSI-06.17","GSI-06.18","GSI-06.19","GSI-06.20","GSI-06.21","GSI-06.22","GSI-06.23","GSI-06.24"]},"GSI-07":{"name":"Player orders, missions, radio, docking, and transport","systems":["GSI-07.01","GSI-07.02","GSI-07.03","GSI-07.04","GSI-07.05","GSI-07.06","GSI-07.07","GSI-07.08","GSI-07.09","GSI-07.10","GSI-07.11","GSI-07.12","GSI-07.13","GSI-07.14","GSI-07.15","GSI-07.16","GSI-07.17","GSI-07.18","GSI-07.19","GSI-07.20","GSI-07.21","GSI-07.22","GSI-07.23","GSI-07.24","GSI-07.25","GSI-07.26","GSI-07.27","GSI-07.28","GSI-07.29","GSI-07.30","GSI-07.31","GSI-07.32","GSI-07.33","GSI-07.34","GSI-07.35","GSI-07.36","GSI-07.37","GSI-07.38","GSI-07.39","GSI-07.40","GSI-07.41","GSI-07.42","GSI-07.43","GSI-07.44","GSI-07.45"]},"GSI-08":{"name":"Combat, weapons, damage, and status mechanics","systems":["GSI-08.01","GSI-08.02","GSI-08.03","GSI-08.04","GSI-08.05","GSI-08.06","GSI-08.07","GSI-08.08","GSI-08.09","GSI-08.10","GSI-08.11","GSI-08.12","GSI-08.13","GSI-08.14","GSI-08.15","GSI-08.16","GSI-08.17","GSI-08.18","GSI-08.19","GSI-08.20","GSI-08.21","GSI-08.22","GSI-08.23","GSI-08.24","GSI-08.25","GSI-08.26","GSI-08.27","GSI-08.28","GSI-08.29","GSI-08.30","GSI-08.31","GSI-08.32","GSI-08.33","GSI-08.34"]},"GSI-09":{"name":"Economy, technology, construction, and production","systems":["GSI-09.01","GSI-09.02","GSI-09.03","GSI-09.04","GSI-09.05","GSI-09.06","GSI-09.07","GSI-09.08","GSI-09.09","GSI-09.10","GSI-09.11","GSI-09.12","GSI-09.13","GSI-09.14","GSI-09.15","GSI-09.16","GSI-09.17","GSI-09.18","GSI-09.19","GSI-09.20","GSI-09.21"]},"GSI-10":{"name":"AI, teams, scripts, triggers, and outcomes","systems":["GSI-10.01","GSI-10.02","GSI-10.03","GSI-10.04","GSI-10.05","GSI-10.06","GSI-10.07","GSI-10.08","GSI-10.09","GSI-10.10","GSI-10.11","GSI-10.12","GSI-10.13","GSI-10.14","GSI-10.15","GSI-10.16"]},"GSI-11":{"name":"Superweapons and strategic special actions","systems":["GSI-11.01","GSI-11.02","GSI-11.03","GSI-11.04","GSI-11.05","GSI-11.06","GSI-11.07","GSI-11.08","GSI-11.09","GSI-11.10","GSI-11.11","GSI-11.12"]},"GSI-12":{"name":"Visibility, intelligence, disguise, and radar","systems":["GSI-12.01","GSI-12.02","GSI-12.03","GSI-12.04","GSI-12.05","GSI-12.06","GSI-12.07","GSI-12.08","GSI-12.09","GSI-12.10","GSI-12.11"]},"GSI-13":{"name":"World rendering and visual effects","systems":["GSI-13.01","GSI-13.02","GSI-13.03","GSI-13.04","GSI-13.05","GSI-13.06","GSI-13.07","GSI-13.08","GSI-13.09","GSI-13.10","GSI-13.11","GSI-13.12","GSI-13.13","GSI-13.14","GSI-13.15","GSI-13.16","GSI-13.17","GSI-13.18","GSI-13.19","GSI-13.20","GSI-13.21","GSI-13.22","GSI-13.23","GSI-13.24","GSI-13.25","GSI-13.26"]},"GSI-14":{"name":"Input, commands, and in-game user interface","systems":["GSI-14.01","GSI-14.02","GSI-14.03","GSI-14.04","GSI-14.05","GSI-14.06","GSI-14.07","GSI-14.08","GSI-14.09","GSI-14.10","GSI-14.11","GSI-14.12","GSI-14.13"]},"GSI-15":{"name":"Audio, speech, music, and video","systems":["GSI-15.01","GSI-15.02","GSI-15.03","GSI-15.04","GSI-15.05","GSI-15.06","GSI-15.07","GSI-15.08","GSI-15.09","GSI-15.10","GSI-15.11"]},"GSI-16":{"name":"Networking and multiplayer protocol","systems":["GSI-16.01","GSI-16.02","GSI-16.03","GSI-16.04","GSI-16.05","GSI-16.06","GSI-16.07","GSI-16.08","GSI-16.09","GSI-16.10","GSI-16.11","GSI-16.12","GSI-16.13","GSI-16.14"]},"GSI-17":{"name":"Persistence, restoration, and deterministic evidence","systems":["GSI-17.01","GSI-17.02","GSI-17.03","GSI-17.04","GSI-17.05","GSI-17.06","GSI-17.07","GSI-17.08","GSI-17.09"]},"GSI-18":{"name":"Compiled legacy, stock-disabled, and developer/tooling surfaces","systems":["GSI-18.01","GSI-18.02","GSI-18.03","GSI-18.04","GSI-18.05","GSI-18.06","GSI-18.07","GSI-18.08"]}},"schema_version":2,"service_catalog":["abstract-object","bridge-helpers","cell-map","cell-validation","damage-helpers","drawing-helpers","factory-house","frontier-ai-house","frontier-ai-team","frontier-ai-trigger","frontier-anim","frontier-audio-eva","frontier-audio-theme","frontier-audio-voc","frontier-blitter","frontier-bullet","frontier-capture","frontier-input-command","frontier-mix-vfs","frontier-net-eventqueue","frontier-net-transport","frontier-particle","frontier-radar","frontier-render-layer","frontier-render-tactical","frontier-saveload","frontier-sidebar","frontier-super","frontier-trigger","frontier-voxelanim","gadget-dialog","ini-parsing","logicclass","lookup-tables","mission-radio","pathfinding-helpers","random-scenario","rules-class","shell-dialog","target-scoring","techno-foot"],"systems":{"GSI-01.01":{"baseline_status":{"activity":"STOCK_ACTIVE","basis":"INV+FAMILY_SCAN","inventory_evidence":"DISCOVERED","native_evidence":"UNCHECKED","parity":"UNCHECKED","rust_implementation":"PARTIAL"},"discovery_scope":"stock/platform","family":"GSI-01","family_name":"Runtime, platform, and global execution","name":"executable bootstrap, process environment, and startup checks","source_line":202},"GSI-01.02":{"baseline_status":{"activity":"STOCK_ACTIVE","basis":"INV+FAMILY_SCAN","inventory_evidence":"DISCOVERED","native_evidence":"UNCHECKED","parity":"UNCHECKED","rust_implementation":"PARTIAL"},"discovery_scope":"stock/platform","family":"GSI-01","family_name":"Runtime, platform, and global execution","name":"window creation, Windows message pump, activation, and focus","source_line":203},"GSI-01.03":{"baseline_status":{"activity":"STOCK_ACTIVE","basis":"CORE-MAIN-GAME","inventory_evidence":"BOUNDED","native_evidence":"ANCHORED","parity":"UNCHECKED","rust_implementation":"PARTIAL"},"discovery_scope":"stock","family":"GSI-01","family_name":"Runtime, platform, and global execution","name":"top-level shell/game state machine","source_line":204},"GSI-01.04":{"baseline_status":{"activity":"STOCK_ACTIVE","basis":"CORE-LIFECYCLE","inventory_evidence":"BOUNDED","native_evidence":"CONTRACTED","parity":"UNCHECKED","rust_implementation":"PARTIAL"},"discovery_scope":"stock","family":"GSI-01","family_name":"Runtime, platform, and global execution","name":"scenario initialization, start, exit, and teardown lifecycle","source_line":205},"GSI-01.05":{"baseline_status":{"activity":"STOCK_ACTIVE","basis":"CORE-SCHEDULER","inventory_evidence":"BOUNDED","native_evidence":"CONTRACTED","parity":"DRIFT","rust_implementation":"PARTIAL"},"discovery_scope":"stock","family":"GSI-01","family_name":"Runtime, platform, and global execution","name":"deterministic per-tick global scheduler and rung order","source_line":206},"GSI-01.06":{"baseline_status":{"activity":"GROUP_NODE","basis":"MIXED-SCOPE","inventory_evidence":"GROUP_NODE","native_evidence":"N/A","parity":"N/A","rust_implementation":"N/A"},"discovery_scope":"mixed","family":"GSI-01","family_name":"Runtime, platform, and global execution","name":"clocks, frame pacing, game speed, pause, and modal pumping","source_line":207},"GSI-01.07":{"baseline_status":{"activity":"STOCK_ACTIVE","basis":"RNG-SCENARIO","inventory_evidence":"BOUNDED","native_evidence":"CONTRACTED","parity":"UNCHECKED","rust_implementation":"PRESENT"},"discovery_scope":"stock","family":"GSI-01","family_name":"Runtime, platform, and global execution","name":"scenario-owned deterministic RNG stream (`ScenarioClass+0x218`)","source_line":208},"GSI-01.08":{"baseline_status":{"activity":"STOCK_ACTIVE","basis":"RNG-MAIN","inventory_evidence":"BOUNDED","native_evidence":"CONTRACTED","parity":"DRIFT","rust_implementation":"PARTIAL"},"discovery_scope":"stock","family":"GSI-01","family_name":"Runtime, platform, and global execution","name":"main/global deterministic gameplay RNG (`g_MainRng`)","source_line":209},"GSI-01.09":{"baseline_status":{"activity":"MODE_ACTIVE","basis":"RNG-MAPGEN","inventory_evidence":"BOUNDED","native_evidence":"CONTRACTED","parity":"UNCHECKED","rust_implementation":"PARTIAL"},"discovery_scope":"stock/mode","family":"GSI-01","family_name":"Runtime, platform, and global execution","name":"separately seeded random-map-generation RNG (`g_MapGenRng`)","source_line":210},"GSI-01.10":{"baseline_status":{"activity":"STOCK_ACTIVE","basis":"TIMER-CADENCE","inventory_evidence":"BOUNDED","native_evidence":"CONTRACTED","parity":"DRIFT","rust_implementation":"PARTIAL"},"discovery_scope":"stock","family":"GSI-01","family_name":"R